[{"id":"osm-n10048392432","name":null,"lat":-18.71531,"lng":-39.85851,"src":"osm"},{"id":"osm-n10265679938","name":null,"lat":-18.72993,"lng":-39.86029,"src":"osm"},{"id":"osm-n10265679939","name":null,"lat":-18.72994,"lng":-39.86001,"src":"osm"},{"id":"osm-n4858274148","name":null,"lat":-18.7156,"lng":-39.8568,"src":"osm"},{"id":"osm-n4858274149","name":null,"lat":-18.71581,"lng":-39.8568,"src":"osm"},{"id":"osm-n4876248436","name":null,"lat":-18.71598,"lng":-39.8794,"src":"osm"},{"id":"osm-n6465967586","name":"Ponto de ônibus","lat":-18.71637,"lng":-39.86735,"src":"osm"},{"id":"osm-n6465967587","name":"Ponto de ônibus","lat":-18.71696,"lng":-39.86655,"src":"osm"}]